,pdbid,title,deposition_date,experimental_method,related_structures,water,polypeptide,dna,rna,dna/rna,sugar,ligand,carbohydrate_polymer,other,assemblies,assembly_id,name,form
0,10mh,"TERNARY STRUCTURE OF HHAI METHYLTRANSFERASE WITH ADOHCY AND HEMIMETHYLATED DNA CONTAINING 5,6-DIHYDRO-5-AZACYTOSINE AT THE TARGET",19980810,['X-ray diffraction'],[],1,1,2,0,0,0,1,0,0,1,1,trimer,hetero
1,173d,"MULTIPLE BINDING MODES OF ANTICANCER DRUG ACTINOMYCIN D: X-RAY, MOLECULAR MODELING, AND SPECTROSCOPIC STUDIES OF D(GAAGCTTC)2-ACTINOMYCIN D COMPLEXES AND ITS HOST DNA",19940418,['X-ray diffraction'],[],1,1,1,0,0,0,0,0,0,2,1,tetramer,hetero
2,185d,"SEQUENCE SPECIFICITY OF QUINOXALINE ANTIBIOTICS. 1. SOLUTION STRUCTURE OF A 1:1 COMPLEX BETWEEN TRIOSTIN A AND [D(GACGTC)]2 AND COMPARISON WITH THE SOLUTION STRUCTURE OF THE [N-MECYS3, N-MECYS7]TANDEM-[D(GATATC)]2 COMPLEX",19940810,['Solution NMR'],[],0,1,1,0,0,0,1,0,0,1,1,trimer,hetero
3,193d,SOLUTION STRUCTURE OF A QUINOMYCIN BISINTERCALATOR-DNA COMPLEX,19940930,['Solution NMR'],[],0,1,1,0,0,0,1,0,0,1,1,trimer,hetero
4,1a02,"STRUCTURE OF THE DNA BINDING DOMAINS OF NFAT, FOS AND JUN BOUND TO DNA",19971208,['X-ray diffraction'],[],1,3,2,0,0,0,0,0,0,1,1,pentamer,hetero
5,1a0a,PHOSPHATE SYSTEM POSITIVE REGULATORY PROTEIN PHO4/DNA COMPLEX,19971127,['X-ray diffraction'],[],1,1,2,0,0,0,0,0,0,1,1,tetramer,hetero
6,1a1f,DSNR (ZIF268 VARIANT) ZINC FINGER-DNA COMPLEX (GACC SITE),19971210,['X-ray diffraction'],[],1,1,2,0,0,0,1,0,0,1,1,trimer,hetero
7,1a1g,DSNR (ZIF268 VARIANT) ZINC FINGER-DNA COMPLEX (GCGT SITE),19971210,['X-ray diffraction'],[],1,1,2,0,0,0,1,0,0,1,1,trimer,hetero
8,1a1h,QGSR (ZIF268 VARIANT) ZINC FINGER-DNA COMPLEX (GCAC SITE),19971210,['X-ray diffraction'],[],1,1,2,0,0,0,1,0,0,1,1,trimer,hetero
9,1a1i,RADR (ZIF268 VARIANT) ZINC FINGER-DNA COMPLEX (GCAC SITE),19971210,['X-ray diffraction'],[],1,1,2,0,0,0,1,0,0,1,1,trimer,hetero
10,1a1j,RADR (ZIF268 VARIANT) ZINC FINGER-DNA COMPLEX (GCGT SITE),19971210,['X-ray diffraction'],[],1,1,2,0,0,0,1,0,0,1,1,trimer,hetero
11,1a1k,RADR (ZIF268 VARIANT) ZINC FINGER-DNA COMPLEX (GACC SITE),19971210,['X-ray diffraction'],[],1,1,2,0,0,0,1,0,0,1,1,trimer,hetero
12,1a1l,ZIF268 ZINC FINGER-DNA COMPLEX (GCAC SITE),19971210,['X-ray diffraction'],[],1,1,2,0,0,0,1,0,0,1,1,trimer,hetero
13,1a1v,HEPATITIS C VIRUS NS3 HELICASE DOMAIN COMPLEXED WITH SINGLE STRANDED SDNA,19971217,['X-ray diffraction'],[],1,1,1,0,0,0,1,0,0,1,1,dimer,hetero
14,1a31,HUMAN RECONSTITUTED DNA TOPOISOMERASE I IN COVALENT COMPLEX WITH A 22 BASE PAIR DNA DUPLEX,19980127,['X-ray diffraction'],[],1,1,2,0,0,0,0,0,0,1,1,trimer,hetero
15,1a35,HUMAN TOPOISOMERASE I/DNA COMPLEX,19980129,['X-ray diffraction'],[],1,1,2,0,0,0,0,0,0,1,1,trimer,hetero
16,1a36,TOPOISOMERASE I/DNA COMPLEX,19980129,['X-ray diffraction'],[],1,1,2,0,0,0,0,0,0,1,1,trimer,hetero
17,1a3q,HUMAN NF-KAPPA-B P52 BOUND TO DNA,19980123,['X-ray diffraction'],[],1,1,2,0,0,0,0,0,0,1,1,tetramer,hetero
18,1a66,"SOLUTION NMR STRUCTURE OF THE CORE NFATC1/DNA COMPLEX, 18 STRUCTURES",19980306,['Solution NMR'],[],0,1,2,0,0,0,0,0,0,1,1,trimer,hetero
19,1a6b,"NMR STRUCTURE OF THE COMPLEX BETWEEN THE ZINC FINGER PROTEIN NCP10 OF MOLONEY MURINE LEUKEMIA VIRUS AND A SEQUENCE OF THE PSI-PACKAGING DOMAIN OF HIV-1, 20 STRUCTURES",19980223,['Solution NMR'],[],0,1,1,0,0,0,1,0,0,1,1,dimer,hetero
